"Question","Answer","Category","Is Featured","Display Order","ID","Created Date","Updated Date","Owner"
"What is the typical timeline for a new home construction project?","The timeline for a new home construction project can vary significantly based on size, complexity, and local regulations. Generally, it ranges from 6 to 12 months from groundbreaking to completion. This includes phases like foundation, framing, roofing, interior finishes, and final inspections.","Timelines",true,1,"0f52a365-2cce-4720-8b98-c6c0583d8742",2026-01-27T16:55:02Z,2026-01-27T16:55:02Z,"dc69aba8-38b9-4862-b565-3bf5f61f7430"
"What kind of warranty do you offer on your construction work?","We offer a comprehensive warranty on all our construction work, typically covering structural elements for 10 years, mechanical systems for 2 years, and finishes for 1 year. Specific warranty details will be outlined in your contract for full transparency.","Policies",true,5,"12eaadad-dc7e-4afe-bbb3-8243ac032d57",2026-01-27T16:55:02Z,2026-01-27T16:55:02Z,"dc69aba8-38b9-4862-b565-3bf5f61f7430"
"What permits are required for a renovation project?","The permits required depend on the scope and location of your renovation. Common permits include building permits, electrical permits, plumbing permits, and sometimes zoning permits. We handle all necessary permit applications as part of our service to ensure compliance.","Policies",true,3,"1a1b3505-b36b-4458-9047-cae515d59f7a",2026-01-27T16:55:02Z,2026-01-29T17:01:55Z,"dc69aba8-38b9-4862-b565-3bf5f61f7430"
"Can I make changes to the design during construction?","While it's best to finalize designs before construction begins, we understand that changes may be necessary. Any changes requested during construction will be documented as a change order, which may affect the project timeline and cost. We'll discuss all implications with you beforehand.","Process",true,4,"84e16ba2-98c4-4e16-be03-92dc50721b52",2026-01-27T16:55:02Z,2026-01-29T17:02:04Z,"dc69aba8-38b9-4862-b565-3bf5f61f7430"
"How do you ensure project quality and safety?","Quality and safety are our top priorities. We adhere to strict industry standards, employ experienced and certified professionals, conduct regular site inspections, and use high-quality materials. Our safety protocols comply with all local and national regulations.","Process",true,6,"86243124-8bb1-4416-b892-1452a931128a",2026-01-27T16:55:02Z,2026-01-27T16:55:02Z,"dc69aba8-38b9-4862-b565-3bf5f61f7430"
"How do I get a quote for my construction project?","To get a detailed quote, please contact us via our website, phone, or email. We'll schedule an initial consultation to discuss your project requirements, scope, and budget. Following this, we'll provide a comprehensive proposal tailored to your needs.","Process",true,2,"870c02e8-fb0f-43ff-b7da-0704be0280a9",2026-01-27T16:55:02Z,2026-01-27T16:55:02Z,"dc69aba8-38b9-4862-b565-3bf5f61f7430"
"Do you handle commercial as well as residential projects?","Yes, we have extensive experience in both residential and commercial construction projects. Our portfolio includes custom homes, multi-family dwellings, office buildings, retail spaces, and industrial facilities, demonstrating our versatility.","Policies",true,8,"ce062fb1-f37b-4bc9-bd53-1e5d6401e021",2026-01-27T16:55:02Z,2026-01-29T17:02:12Z,"dc69aba8-38b9-4862-b565-3bf5f61f7430"
"What is the payment schedule for a typical construction project?","Payment schedules are typically structured in phases, with an initial deposit followed by progress payments tied to key milestones (e.g., foundation completion, framing, rough-ins, substantial completion). The final payment is due upon project completion and client satisfaction.","Timelines",true,7,"f0a4c5b5-8dc3-4b72-b2c7-27263f8d45a5",2026-01-27T16:55:02Z,2026-01-29T17:02:10Z,"dc69aba8-38b9-4862-b565-3bf5f61f7430"
